{
  "$schema": "https://json-schema.org/draft/2020-12/schema",
  "$id": "https://github.com/hveitia/flutter_senior_dev_challenge_bi/contracts/home-config.schema.json",
  "title": "Published home configuration",
  "description": "What the backoffice must publish at config/home. It is deliberately stricter than the reader: the mobile app tolerates documents that break these rules (see docs/adr/0008), so that a wrong publish degrades the home instead of breaking installed apps. Publishers validate against this schema; readers must ignore unknown fields.",
  "type": "object",
  "required": [
    "schemaVersion",
    "configVersion",
    "destinations",
    "segments"
  ],
  "additionalProperties": true,
  "properties": {
    "schemaVersion": {
      "type": "integer",
      "minimum": 1,
      "description": "Version of this contract. A reader that supports a lower version keeps its last valid configuration."
    },
    "configVersion": {
      "type": "integer",
      "minimum": 0,
      "description": "Counter increased on every publish. Informative: the reader applies the last document it receives, whatever its number."
    },
    "locale": {
      "type": "string",
      "deprecated": true,
      "description": "Not read by any app version. Present only because the design example carries it; amounts are always shown as $4,820.35."
    },
    "currency": {
      "type": "string",
      "deprecated": true,
      "description": "Not read by any app version. Present only because the design example carries it; amounts are always shown as $4,820.35."
    },
    "destinations": {
      "type": "array",
      "description": "Allow-list of navigation destinations. An action pointing anywhere else is dropped by the reader.",
      "items": {
        "type": "string",
        "minLength": 1
      },
      "uniqueItems": true
    },
    "resilience": {
      "$ref": "#/$defs/resilience"
    },
    "segments": {
      "type": "object",
      "minProperties": 1,
      "additionalProperties": {
        "$ref": "#/$defs/segment"
      }
    }
  },
  "$defs": {
    "resilience": {
      "type": "object",
      "description": "Fault injection for demonstration environments. Ignored by any app build that was not made with ALLOW_FAULT_INJECTION.",
      "additionalProperties": true,
      "properties": {
        "latencyMs": {
          "type": "integer",
          "minimum": 0,
          "maximum": 10000,
          "default": 0,
          "description": "Delay added to every attempt. The reader clamps it to this range."
        },
        "movementsUnavailable": {
          "type": "boolean",
          "default": false
        },
        "partnerInsuranceUnavailable": {
          "type": "boolean",
          "default": false
        }
      }
    },
    "segment": {
      "type": "object",
      "required": [
        "label",
        "modules",
        "features"
      ],
      "additionalProperties": true,
      "properties": {
        "label": {
          "type": "string",
          "minLength": 1,
          "description": "Name shown to people. The reader falls back to the segment id when it is missing."
        },
        "modules": {
          "type": "array",
          "items": {
            "$ref": "#/$defs/module"
          }
        },
        "features": {
          "$ref": "#/$defs/features"
        }
      }
    },
    "module": {
      "type": "object",
      "required": [
        "id",
        "type"
      ],
      "additionalProperties": true,
      "properties": {
        "id": {
          "type": "string",
          "minLength": 1,
          "description": "Unique within its segment. JSON Schema cannot express that, so the publisher must check it; the reader keeps the first module with a given id."
        },
        "type": {
          "type": "string",
          "minLength": 1,
          "description": "Key of the widget registered by a domain package. Unknown types are skipped by the reader."
        },
        "visible": {
          "type": "boolean",
          "default": true
        },
        "props": {
          "type": "object",
          "default": {},
          "description": "Settings interpreted by the module itself, nested at most 32 levels. Any object carrying a destination must use a value from the allow-list; the reader drops the ones that do not."
        }
      }
    },
    "features": {
      "type": "object",
      "additionalProperties": true,
      "properties": {
        "transfers": {
          "type": "boolean",
          "default": false
        },
        "partnerServices": {
          "type": "boolean",
          "default": false
        }
      },
      "required": [
        "transfers",
        "partnerServices"
      ],
      "description": "Every flag must be stated. The reader treats a missing flag as off."
    }
  }
}
